{
  "contract_version": 1,
  "request_id": "req-2026-10-24-0001",
  "created_at": "2026-10-24T05:30:00Z",
  "repository": "OWNER/REPO",
  "workflow": {
    "name": "ci.yml",
    "ref": "refs/heads/main",
    "event": "push"
  },
  "runner": {
    "labels": ["devgate"],
    "trust_class": "public"
  },
  "demand": {
    "concurrency": 1,
    "timeout_minutes": 60,
    "ephemeral": true
  }
}
